{
  "automation_estimate": null,
  "ci_flags": {
    "OPT_IN_TEST_MAX_PHP": 0,
    "OPT_IN_TEST_PREVIOUS_MAJOR": 1
  },
  "core_removals": null,
  "data_hash": "sha256:ae3ca627268988567255f71e96ff587186438a661868b8cc70d8ca9789efe8cb",
  "detectors": [
    "removed-ext-11",
    "signature-changes"
  ],
  "hard_breaks": null,
  "hops": [
    "10-11"
  ],
  "meta": {
    "drupilot_version": "1.0.0-alpha.1",
    "generated_at": "2026-10-05T10:00:00Z",
    "phase": "final"
  },
  "patch_name": "legacy_widgets-port-to-drupal-11.patch",
  "php": {
    "final": "8.3",
    "floor": "8.1",
    "phpcompat_testversion": "8.1-8.3",
    "phpstan_phpversion": {
      "max": 80300,
      "min": 80100
    },
    "require_php": ">=8.1",
    "window": [
      "8.1",
      "8.2",
      "8.3"
    ]
  },
  "phpstan": {
    "level": 2,
    "profile": "compat"
  },
  "range": {
    "constraint": "^10 || ^11",
    "floor": "10.0",
    "resolved_strategy": "keep-previous",
    "spans_majors": true,
    "strategy": "auto"
  },
  "rector": {
    "bc": {
      "enabled": false,
      "min_core": null
    },
    "breaking_sets": [],
    "compat_rules": null,
    "drupal_sets": [
      "Drupal10SetList::DRUPAL_100",
      "Drupal10SetList::DRUPAL_101",
      "Drupal10SetList::DRUPAL_102",
      "Drupal10SetList::DRUPAL_103"
    ],
    "php_level": "PHP_81",
    "polyfills": null,
    "sets_skipped": [],
    "skip": [
      "Rector\\Php81\\Rector\\Array_\\ArrayToFirstClassCallableRector",
      "Rector\\Php83\\Rector\\ClassMethod\\AddOverrideAttributeToOverriddenMethodsRector",
      "Rector\\Php81\\Rector\\Property\\ReadOnlyPropertyRector",
      "Rector\\Php82\\Rector\\Class_\\ReadOnlyClassRector",
      "Rector\\Php81\\Rector\\FuncCall\\NullToStrictStringFuncCallArgRector",
      "Rector\\Php85\\Rector\\Class_\\SleepToSerializeRector",
      "Rector\\Php85\\Rector\\Class_\\WakeupToUnserializeRector",
      "Rector\\Php85\\Rector\\Property\\AddOverrideAttributeToOverriddenPropertiesRector"
    ],
    "tests_pass": null
  },
  "schema_version": 1,
  "source": {
    "evidence_hash": "sha256:701087d1e76594b45d39eaee6962668d918df17622af3e2e1783f0a8007dc6e5",
    "major": 10,
    "track": "standard"
  },
  "subject": {
    "machine_name": "legacy_widgets",
    "type": "module"
  },
  "target": {
    "bed_core": "11.4.8",
    "ddev_type": "drupal11",
    "major": 11,
    "preview": false,
    "status": "supported"
  },
  "test_matrix": [
    {
      "core": "11.4.8",
      "leg": "CURRENT",
      "mode": "run",
      "php": "8.3"
    },
    {
      "core": "10.6",
      "leg": "PREVIOUS_MAJOR",
      "mode": "static",
      "php": "8.1"
    }
  ],
  "toolchain_cell": "11",
  "workspace_suffix": "-d11"
}
